<!ELEMENT MB_orarend (ora*)>

<!ELEMENT ora (targy, idopont, helyszin, oktato, szak)>
<!ATTLIST ora 
  id ID #REQUIRED
  tipus (eloadas|gyakorlat) #REQUIRED
>

<!ELEMENT idopont (nap, tol, ig)>
<!ELEMENT nap (#PCDATA)>
<!ELEMENT tol (#PCDATA)>
<!ELEMENT ig (#PCDATA)>

<!ELEMENT targy (#PCDATA)>
<!ELEMENT helyszin (#PCDATA)>
<!ELEMENT oktato (#PCDATA)>
<!ELEMENT szak (#PCDATA)>
